[
  {
    "record_format_version": 2,
    "template_only": false,
    "eligible_for_evaluation": false,
    "case_id": "syn-ar-01",
    "dataset_version": "capstone-v1-draft",
    "provenance": {
      "source_category": "synthetic",
      "source_reference": "owner-request-synthetic40-20261002",
      "author_id": "coding-assistant",
      "created_on": "2026-10-02",
      "permission_reference": "owner-authorized-generation-20261002-not-participant-data",
      "prior_exposure": "exposed"
    },
    "language_group": "egyptian_arabic",
    "script": "arabic",
    "scenario_tags": ["typo", "negation", "budget", "size"],
    "input": {
      "message": "عايز كوتش جري مقاس ٤٢ لحد ١٨٠٠ جنييه ومش جلد خالص",
      "followup_turns": [],
      "sanitized_context_reference": null,
      "context_sha256": null,
      "requires_context": false
    },
    "expected": {
      "intent": "find_products",
      "constraints": {
        "category": "shoes",
        "product_type": "running",
        "size": "42",
        "max_price": {
          "amount": "1800",
          "currency": "EGP"
        }
      },
      "needs_clarification": false,
      "clarification_fields": [],
      "acceptable_targets": [],
      "quantity_mode": null,
      "quantity": null,
      "cart_operation": null,
      "mutation_kind": null,
      "catalogue_requirements": [
        {
          "kind": "feature",
          "value": "leather",
          "excluded": true,
          "source": "مش جلد خالص"
        }
      ],
      "semantic_notes": "Upper price bound is inclusive; leather is an exclusion, not a soft preference."
    },
    "grouping": {
      "paraphrase_group_id": "family-running-no-leather",
      "conversation_group_id": "conv-syn-ar-01",
      "split": null,
      "duplicate_review": "pending_semantic_review"
    },
    "comparison": {
      "intent_only_eligible": true,
      "eligibility_reason": "Self-contained top-level capability under the fixed Storefront task definition."
    },
    "annotation": {
      "annotator_id": "coding-assistant",
      "reviewer_id": null,
      "status": "draft_unreviewed",
      "disagreements": [],
      "resolution": null
    }
  },
  {
    "record_format_version": 2,
    "template_only": false,
    "eligible_for_evaluation": false,
    "case_id": "syn-ar-02",
    "dataset_version": "capstone-v1-draft",
    "provenance": {
      "source_category": "synthetic",
      "source_reference": "owner-request-synthetic40-20261002",
      "author_id": "coding-assistant",
      "created_on": "2026-10-02",
      "permission_reference": "owner-authorized-generation-20261002-not-participant-data",
      "prior_exposure": "exposed"
    },
    "language_group": "egyptian_arabic",
    "script": "arabic",
    "scenario_tags": ["styling", "owned_item", "opinion"],
    "input": {
      "message": "عندي بنطلون اسود.. رايك البس عليه لون ايه لو رايح عزومه؟",
      "followup_turns": [],
      "sanitized_context_reference": null,
      "context_sha256": null,
      "requires_context": false
    },
    "expected": {
      "intent": "advice",
      "constraints": {},
      "needs_clarification": false,
      "clarification_fields": [],
      "acceptable_targets": [],
      "quantity_mode": null,
      "quantity": null,
      "cart_operation": null,
      "mutation_kind": null,
      "catalogue_requirements": [],
      "semantic_notes": "Black describes an owned pair of trousers, not a mandatory purchase colour. Styling opinion must be distinguished from product facts."
    },
    "grouping": {
      "paraphrase_group_id": "family-outfit-colour",
      "conversation_group_id": "conv-syn-ar-02",
      "split": null,
      "duplicate_review": "pending_semantic_review"
    },
    "comparison": {
      "intent_only_eligible": true,
      "eligibility_reason": "Self-contained top-level capability under the fixed Storefront task definition."
    },
    "annotation": {
      "annotator_id": "coding-assistant",
      "reviewer_id": null,
      "status": "draft_unreviewed",
      "disagreements": [],
      "resolution": null
    }
  },
  {
    "record_format_version": 2,
    "template_only": false,
    "eligible_for_evaluation": false,
    "case_id": "syn-ar-03",
    "dataset_version": "capstone-v1-draft",
    "provenance": {
      "source_category": "synthetic",
      "source_reference": "owner-request-synthetic40-20261002",
      "author_id": "coding-assistant",
      "created_on": "2026-10-02",
      "permission_reference": "owner-authorized-generation-20261002-not-participant-data",
      "prior_exposure": "exposed"
    },
    "language_group": "egyptian_arabic",
    "script": "arabic",
    "scenario_tags": ["negation", "navigation"],
    "input": {
      "message": "وديني لحسابي بقا مش صفحة الاوردرات",
      "followup_turns": [],
      "sanitized_context_reference": null,
      "context_sha256": null,
      "requires_context": false
    },
    "expected": {
      "intent": "navigate",
      "constraints": {
        "target": "account"
      },
      "needs_clarification": false,
      "clarification_fields": [],
      "acceptable_targets": [],
      "quantity_mode": null,
      "quantity": null,
      "cart_operation": null,
      "mutation_kind": null,
      "catalogue_requirements": [],
      "semantic_notes": ""
    },
    "grouping": {
      "paraphrase_group_id": "family-account-nav",
      "conversation_group_id": "conv-syn-ar-03",
      "split": null,
      "duplicate_review": "pending_semantic_review"
    },
    "comparison": {
      "intent_only_eligible": true,
      "eligibility_reason": "Self-contained top-level capability under the fixed Storefront task definition."
    },
    "annotation": {
      "annotator_id": "coding-assistant",
      "reviewer_id": null,
      "status": "draft_unreviewed",
      "disagreements": [],
      "resolution": null
    }
  },
  {
    "record_format_version": 2,
    "template_only": false,
    "eligible_for_evaluation": false,
    "case_id": "syn-ar-04",
    "dataset_version": "capstone-v1-draft",
    "provenance": {
      "source_category": "synthetic",
      "source_reference": "owner-request-synthetic40-20261002",
      "author_id": "coding-assistant",
      "created_on": "2026-10-02",
      "permission_reference": "owner-authorized-generation-20261002-not-participant-data",
      "prior_exposure": "exposed"
    },
    "language_group": "egyptian_arabic",
    "script": "arabic",
    "scenario_tags": ["quantity", "multi_product", "typo"],
    "input": {
      "message": "القميص الرسمي الابيض لارج زود عليه تلاته كمان، سيب الكوتشي زي مهو",
      "followup_turns": [],
      "sanitized_context_reference": "eval/datasets/capstone-v1/development/contexts/ar-cart-before.json",
      "context_sha256": "7610521803d8c538eccbe929fb8407b8df144a6eeab30d9e57b34b71333c408a",
      "requires_context": true
    },
    "expected": {
      "intent": "cart_edit",
      "constraints": {},
      "needs_clarification": false,
      "clarification_fields": [],
      "acceptable_targets": ["clothing-05~L~white"],
      "quantity_mode": "increase",
      "quantity": 3,
      "cart_operation": "quantity",
      "mutation_kind": null,
      "catalogue_requirements": [],
      "semantic_notes": "Current quantity 2 becomes 5. Preserve shoe line."
    },
    "grouping": {
      "paraphrase_group_id": "family-shirt-quantity",
      "conversation_group_id": "conv-ar-shirt-correction",
      "split": null,
      "duplicate_review": "pending_semantic_review"
    },
    "comparison": {
      "intent_only_eligible": true,
      "eligibility_reason": "Explicit top-level capability is in this message; contextual entity resolution is scored separately."
    },
    "annotation": {
      "annotator_id": "coding-assistant",
      "reviewer_id": null,
      "status": "draft_unreviewed",
      "disagreements": [],
      "resolution": null
    }
  },
  {
    "record_format_version": 2,
    "template_only": false,
    "eligible_for_evaluation": false,
    "case_id": "syn-ar-05",
    "dataset_version": "capstone-v1-draft",
    "provenance": {
      "source_category": "synthetic",
      "source_reference": "owner-request-synthetic40-20261002",
      "author_id": "coding-assistant",
      "created_on": "2026-10-02",
      "permission_reference": "owner-authorized-generation-20261002-not-participant-data",
      "prior_exposure": "exposed"
    },
    "language_group": "egyptian_arabic",
    "script": "arabic",
    "scenario_tags": ["correction", "reference", "quantity"],
    "input": {
      "message": "لا لا انا قصدي يبقو تلاته كلهم مش تزود تلاته",
      "followup_turns": [],
      "sanitized_context_reference": "eval/datasets/capstone-v1/development/contexts/ar-cart-after.json",
      "context_sha256": "155138872d86635152e7edd66a16ba007b60d32f7ed9f6283894fad17b615465",
      "requires_context": true
    },
    "expected": {
      "intent": "cart_edit",
      "constraints": {},
      "needs_clarification": false,
      "clarification_fields": [],
      "acceptable_targets": ["clothing-05~L~white"],
      "quantity_mode": "set",
      "quantity": 3,
      "cart_operation": "quantity",
      "mutation_kind": null,
      "catalogue_requirements": [],
      "semantic_notes": "Correct the same shirt line to total 3; do not apply another increase."
    },
    "grouping": {
      "paraphrase_group_id": "family-shirt-quantity",
      "conversation_group_id": "conv-ar-shirt-correction",
      "split": null,
      "duplicate_review": "pending_semantic_review"
    },
    "comparison": {
      "intent_only_eligible": false,
      "eligibility_reason": "The affected product and continuation intent require the preceding cart conversation."
    },
    "annotation": {
      "annotator_id": "coding-assistant",
      "reviewer_id": null,
      "status": "draft_unreviewed",
      "disagreements": [],
      "resolution": null
    }
  },
  {
    "record_format_version": 2,
    "template_only": false,
    "eligible_for_evaluation": false,